    1   0.000000 104.26.10.63 → 192.168.1.10 TLSv1.2 86 Application Data
    2   0.024873 192.168.1.10 → 104.26.10.63 TLSv1.2 86 Application Data
    3   0.102203 104.26.10.63 → 192.168.1.10 TLSv1.2 83 Application Data
    4   0.146660 192.168.1.10 → 104.26.10.63 TCP 54 63962 → 8443 [ACK] Seq=33 Ack=62 Win=254 Len=0
    5   0.692238 104.26.10.63 → 192.168.1.10 TLSv1.2 84 Application Data
    6   0.732021 192.168.1.10 → 104.26.10.63 TCP 54 63962 → 8443 [ACK] Seq=33 Ack=92 Win=254 Len=0
    7   0.976619 104.26.10.63 → 192.168.1.10 TLSv1.2 83 Application Data
    8   0.976619 104.26.10.63 → 192.168.1.10 TLSv1.2 99 Application Data
    9   0.976766 192.168.1.10 → 104.26.10.63 TCP 54 63962 → 8443 [ACK] Seq=33 Ack=166 Win=254 Len=0
   10   1.020622 192.168.1.10 → 104.26.10.63 TLSv1.2 86 Application Data
   11   1.098353 104.26.10.63 → 192.168.1.10 TLSv1.2 83 Application Data
   12   1.139378 192.168.1.10 → 104.26.10.63 TCP 54 63962 → 8443 [ACK] Seq=65 Ack=195 Win=254 Len=0
   13   1.210002 104.26.10.63 → 192.168.1.10 TLSv1.2 83 Application Data
   14   1.254286 192.168.1.10 → 104.26.10.63 TCP 54 63962 → 8443 [ACK] Seq=65 Ack=224 Win=254 Len=0
   15   1.592988 192.168.1.10 → 185.125.190.56 NTP 90 NTP Version 4, client
   16   1.654364 162.159.133.234 → 192.168.1.10 TLSv1.2 105 Application Data
   17   1.658387 185.125.190.56 → 192.168.1.10 NTP 90 NTP Version 4, server
   18   1.701433 192.168.1.10 → 162.159.133.234 TCP 54 63823 → 443 [ACK] Seq=1 Ack=52 Win=250 Len=0
   19   2.016244 104.26.10.63 → 192.168.1.10 TLSv1.2 83 Application Data
   20   2.018818 104.26.10.63 → 192.168.1.10 TLSv1.2 96 Application Data
   21   2.018880 192.168.1.10 → 104.26.10.63 TCP 54 63962 → 8443 [ACK] Seq=65 Ack=295 Win=253 Len=0
   22   2.021402 192.168.1.10 → 35.186.224.41 TLSv1.2 97 Application Data
   23   2.021641 192.168.1.10 → 104.26.10.63 TLSv1.2 86 Application Data
   24   2.097937 104.26.10.63 → 192.168.1.10 TLSv1.2 83 Application Data
   25   2.140643 35.186.224.41 → 192.168.1.10 TCP 54 443 → 63884 [ACK] Seq=1 Ack=44 Win=1042 Len=0
   26   2.145322 35.186.224.41 → 192.168.1.10 TLSv1.2 94 Application Data
   27   2.145529 192.168.1.10 → 104.26.10.63 TCP 54 63962 → 8443 [ACK] Seq=97 Ack=324 Win=253 Len=0
   28   2.192684 192.168.1.10 → 35.186.224.41 TCP 54 63884 → 443 [ACK] Seq=44 Ack=41 Win=251 Len=0
   29   3.024558 192.168.1.10 → 104.26.10.63 TLSv1.2 86 Application Data
   30   3.101724 104.26.10.63 → 192.168.1.10 TLSv1.2 82 Application Data
   31   3.145897 192.168.1.10 → 104.26.10.63 TCP 54 63962 → 8443 [ACK] Seq=129 Ack=352 Win=253 Len=0
   32   3.620155 104.26.10.63 → 192.168.1.10 TLSv1.2 83 Application Data
   33   3.673353 192.168.1.10 → 104.26.10.63 TCP 54 63962 → 8443 [ACK] Seq=129 Ack=381 Win=253 Len=0
   34   3.946514 104.26.10.63 → 192.168.1.10 TLSv1.2 83 Application Data
   35   3.995530 192.168.1.10 → 104.26.10.63 TCP 54 63962 → 8443 [ACK] Seq=129 Ack=410 Win=253 Len=0
   36   4.029929 192.168.1.10 → 104.26.10.63 TLSv1.2 86 Application Data
   37   4.108448 104.26.10.63 → 192.168.1.10 TLSv1.2 83 Application Data
   38   4.158821 192.168.1.10 → 104.26.10.63 TCP 54 63962 → 8443 [ACK] Seq=161 Ack=439 Win=253 Len=0
   39   4.264214 104.26.10.63 → 192.168.1.10 TLSv1.2 83 Application Data
   40   4.264214 104.26.10.63 → 192.168.1.10 TLSv1.2 87 Application Data
   41   4.264406 192.168.1.10 → 104.26.10.63 TCP 54 63962 → 8443 [ACK] Seq=161 Ack=501 Win=252 Len=0
   42   4.931829 192.168.1.10 → 172.161.47.103 TCP 55 [TCP segment of a reassembled PDU]
   43   4.987743 172.161.47.103 → 192.168.1.10 TCP 66 443 → 63965 [ACK] Seq=1 Ack=2 Win=251 Len=0 SLE=1 SRE=2
   44   5.027224 192.168.1.10 → 104.26.10.63 TLSv1.2 86 Application Data
   45   5.117011 104.26.10.63 → 192.168.1.10 TCP 54 8443 → 63962 [ACK] Seq=501 Ack=193 Win=10 Len=0
   46   5.117011 104.26.10.63 → 192.168.1.10 TLSv1.2 83 Application Data
   47   5.159500 192.168.1.10 → 104.26.10.63 TCP 54 63962 → 8443 [ACK] Seq=193 Ack=530 Win=252 Len=0
   48   5.424846 162.159.133.234 → 192.168.1.10 TLSv1.2 262 Application Data
   49   5.467689 192.168.1.10 → 162.159.133.234 TCP 54 63823 → 443 [ACK] Seq=1 Ack=260 Win=255 Len=0
   50   5.539980 192.168.1.10 → 35.186.224.26 TCP 55 [TCP segment of a reassembled PDU]
   51   5.551002 192.168.1.10 → 35.186.224.26 TCP 55 [TCP segment of a reassembled PDU]
   52   5.612425 104.26.10.63 → 192.168.1.10 TLSv1.2 86 Application Data
   53   5.640879 104.26.10.63 → 192.168.1.10 TLSv1.2 93 Application Data
   54   5.640951 192.168.1.10 → 104.26.10.63 TCP 54 63962 → 8443 [ACK] Seq=193 Ack=601 Win=252 Len=0
   55   5.646538 35.186.224.26 → 192.168.1.10 TCP 66 443 → 63875 [ACK] Seq=1 Ack=2 Win=1000 Len=0 SLE=1 SRE=2
   56   5.660319 35.186.224.26 → 192.168.1.10 TCP 66 443 → 64014 [ACK] Seq=1 Ack=2 Win=1046 Len=0 SLE=1 SRE=2
   57   5.729604 104.26.10.63 → 192.168.1.10 TLSv1.2 83 Application Data
   58   5.784739 192.168.1.10 → 104.26.10.63 TCP 54 63962 → 8443 [ACK] Seq=193 Ack=630 Win=252 Len=0
   59   6.027659 192.168.1.10 → 104.26.10.63 TLSv1.2 86 Application Data
   60   6.042287 192.168.1.10 → 35.186.224.41 TLSv1.2 82 Application Data
   61   6.071005 104.26.10.63 → 192.168.1.10 TCP 54 8443 → 63962 [ACK] Seq=630 Ack=225 Win=10 Len=0
   62   6.104112 104.26.10.63 → 192.168.1.10 TLSv1.2 83 Application Data
   63   6.150364 192.168.1.10 → 104.26.10.63 TCP 54 63962 → 8443 [ACK] Seq=225 Ack=659 Win=252 Len=0
   64   6.151642 35.186.224.41 → 192.168.1.10 TCP 54 443 → 63910 [ACK] Seq=1 Ack=29 Win=1050 Len=0
   65   6.241451 104.26.10.63 → 192.168.1.10 TLSv1.2 83 Application Data
   66   6.290699 192.168.1.10 → 104.26.10.63 TCP 54 63962 → 8443 [ACK] Seq=225 Ack=688 Win=252 Len=0
   67   6.623517 104.26.10.63 → 192.168.1.10 TLSv1.2 83 Application Data
   68   6.623678 104.26.10.63 → 192.168.1.10 TLSv1.2 86 Application Data
   69   6.623724 192.168.1.10 → 104.26.10.63 TCP 54 63962 → 8443 [ACK] Seq=225 Ack=749 Win=251 Len=0
   70   7.023333 104.26.10.63 → 192.168.1.10 TLSv1.2 83 Application Data
   71   7.024837 192.168.1.10 → 104.26.10.63 TLSv1.2 86 Application Data
   72   7.101179 104.26.10.63 → 192.168.1.10 TLSv1.2 83 Application Data
   73   7.156081 192.168.1.10 → 104.26.10.63 TCP 54 63962 → 8443 [ACK] Seq=257 Ack=807 Win=251 Len=0
   74   7.173870 104.26.10.63 → 192.168.1.10 TLSv1.2 93 Application Data
   75   7.218282 192.168.1.10 → 104.26.10.63 TCP 54 63962 → 8443 [ACK] Seq=257 Ack=846 Win=251 Len=0
